{
    "user_id": "",
    "user_email": "",
    "ip_address": "",
    "signin_with": "",
    "clientver": "1.1.6.3",
    "devicetype": "Handheld",
    "devicemodel": "samsung SM-N976N",
    "deviceos": "Android OS 10 / API-29 (QP1A.190711.020/N976NKSU1CTG3)",
    "deviceuuid": "fde678d3e55b3044865000402408dc46",
    "devicename": "Galaxy Note10+ 5G",
    "signin_at": 0,
    "route": ""
}